{
  "schemaVersion": "4.0",
  "status": "packet-frozen",
  "taskPacket": {
    "id": "integrated-robotic-handling",
    "version": "1.10"
  },
  "taskDefinitionDigest": "76d54bfc3e76b28e488364c78928a4363e17d48708962bb0e8192a3d19ad60d7",
  "packetDigest": "b8622ce708f8e7464b3a1c22c11afcadc5ae9117c388ced617713b549397579f",
  "bundleDigest": "5f8081cc853a0665729885c4cfb3ac9883a8ecb7e1dff0a78c96e24f2391a053",
  "bundleAlgorithm": "sha256-packet-bundle-v1",
  "frozenAt": "2026-07-30T07:31:46.402Z"
}
